{
  "schemaVersion": 1,
  "product": "twk-macro-hub",
  "channel": "stable",
  "revision": 10,
  "generatedAt": "2026-07-24T23:49:07Z",
  "components": {
    "ae": {
      "version": "0.1.11",
      "packageUrl": "https://raw.githubusercontent.com/thosewhomango/twk-macro-releases/package-assets/packages/TWK-ae-0.1.11.zip",
      "packageSize": 10976505,
      "packageSha256": "39700f414eb8af4260662e69596e573001f733eb419f53e4683d0641a79150ca",
      "minimumUpdaterVersion": "0.2.0",
      "mandatory": false,
      "requires": {},
      "releaseNotesUrl": "https://raw.githubusercontent.com/thosewhomango/twk-macro-releases/package-assets/notes/ae/0.1.11.md#sha256=9476d35cfe63ec885bad7b29f27d840b26d3b6a2765043053912a099cedffda2"
    },
    "rapidocr": {
      "version": "0.1.0",
      "packageUrl": "https://raw.githubusercontent.com/thosewhomango/twk-macro-releases/package-assets/packages/TWK-rapidocr-0.1.0.zip",
      "packageSize": 23231804,
      "packageSha256": "e97cbfe8a0a61f1ccb0d68e6584f530c35c1abb1a221497ef4528c94a8b7746d",
      "minimumUpdaterVersion": "0.2.0",
      "mandatory": false,
      "requires": {},
      "releaseNotesUrl": "https://raw.githubusercontent.com/thosewhomango/twk-macro-releases/package-assets/notes/rapidocr/0.1.0.md#sha256=2d90b6f57861f40862873224f76ef9f06c6bf62aba8bb73fac3fbaaf65e250ae"
    }
  },
  "signature": "ed25519:Ax2f2qqg0ikdt9qEQYno1eOPme1KDBPYojBdWqPRZRkipSUbzCoElh6sB5WEghgqWy8/fn6DBMp/qkLxWBB+DQ=="
}
