{
  "schemaVersion": 1,
  "product": "twk-macro-hub",
  "channel": "stable",
  "revision": 29,
  "generatedAt": "2026-07-29T18:53:12Z",
  "components": {
    "ae": {
      "version": "0.1.20",
      "packageUrl": "https://raw.githubusercontent.com/thosewhomango/twk-macro-releases/package-assets/packages/TWK-ae-0.1.20.zip",
      "packageSize": 11970560,
      "packageSha256": "b74f1fbe72c54e9d518108b068bd5e4b3fa2296b499fde6b19c7a7a688a4a592",
      "minimumUpdaterVersion": "0.2.0",
      "mandatory": false,
      "requires": {},
      "releaseNotesUrl": "https://raw.githubusercontent.com/thosewhomango/twk-macro-releases/package-assets/notes/ae/0.1.20.md#sha256=d158262daf85fb2ab1bcd5a3165cff04c7a22c03e08e1ba8ee6b5918613a0c21"
    },
    "rapidocr": {
      "version": "0.1.0",
      "packageUrl": "https://raw.githubusercontent.com/thosewhomango/twk-macro-releases/package-assets/packages/TWK-rapidocr-0.1.0.zip",
      "packageSize": 23231804,
      "packageSha256": "e97cbfe8a0a61f1ccb0d68e6584f530c35c1abb1a221497ef4528c94a8b7746d",
      "minimumUpdaterVersion": "0.2.0",
      "mandatory": false,
      "requires": {},
      "releaseNotesUrl": "https://raw.githubusercontent.com/thosewhomango/twk-macro-releases/package-assets/notes/rapidocr/0.1.0.md#sha256=2d90b6f57861f40862873224f76ef9f06c6bf62aba8bb73fac3fbaaf65e250ae"
    },
    "hub": {
      "version": "1.0.4",
      "packageUrl": "https://raw.githubusercontent.com/thosewhomango/twk-macro-releases/package-assets/packages/TWK-hub-1.0.4.zip",
      "packageSize": 5281499,
      "packageSha256": "f9681903a17ff7cbc79670ad7ccb10e8a308dbe6c000861476d2356ce759d094",
      "minimumUpdaterVersion": "0.2.0",
      "mandatory": false,
      "requires": {},
      "releaseNotesUrl": "https://raw.githubusercontent.com/thosewhomango/twk-macro-releases/package-assets/notes/hub/1.0.4.md#sha256=7df4967cd05f8ddb1e374b3092151173e20495741ae016d3a0607b9ad6668562"
    },
    "updater": {
      "version": "0.3.7",
      "packageUrl": "https://raw.githubusercontent.com/thosewhomango/twk-macro-releases/package-assets/packages/TWK-updater-0.3.7.zip",
      "packageSize": 9234530,
      "packageSha256": "b84e12d7c1b73c02b4a5303ad4ae70261c80a446ba9cdb51eb5c4466965ef4c8",
      "minimumUpdaterVersion": "0.2.0",
      "mandatory": false,
      "requires": {},
      "releaseNotesUrl": "https://raw.githubusercontent.com/thosewhomango/twk-macro-releases/package-assets/notes/updater/0.3.7.md#sha256=0a792100310acec4ffead907dd1d871570aaf443514ac30bae6a3d0246f80b0f"
    }
  },
  "signature": "ed25519:wHKnP2MGidPJlei5neQNPS22e4rnLKM47dv1nhRznXGHBrbyH45Lznljgg0Ag/2utXtJ2XwWIb2+Din3Nu9nDg=="
}
